{
  "schema_version": "codevetter.agent-task.v1",
  "task_id": "keep-zero-page-index",
  "title": "Keep an explicit zero page index",
  "lane": "browser",
  "runtime": "typescript",
  "category": "browser-state",
  "failure_mode": "falsy-pagination-state",
  "artifacts": {
    "fixture": {
      "path": "fixture.json",
      "sha256": "7cb3e6437799e062b22d1fcb31e2ec1bf9a53239ffb495e4db7ba43563ac8ec4"
    },
    "task_packet": {
      "path": "task.md",
      "sha256": "4b966976b53a8f947db6b0f402330bb996b203fabaaed26f5a92b9cb673fbfc7"
    },
    "acceptance_contract": {
      "path": "acceptance-contract.json",
      "sha256": "a43929ada52c76305a217b19ce722a137affc3a983d4f3b4015c4960541c8046"
    },
    "known_good_patch": {
      "path": "known-good.json",
      "sha256": "957b02822ef0783d1fa82c363bc71718c2439eec6b29782dbd5cefdcea5fe856"
    }
  },
  "required_checks": ["zero-page-preserved"],
  "regression_checks": ["missing-page-falls-back", "positive-page-preserved"],
  "provenance": {
    "kind": "owned",
    "repository": "Codevetter/codevetter",
    "revision": "7a3dd934f68f4927b66d9e8b8ed317f8ba369aa3"
  },
  "license": {
    "spdx": "ISC",
    "notice": "Owned synthetic corpus fixture; repository license applies."
  }
}
